<!--

    sd7 Project Configuration Document Type Definition
    Copyright (C) 2008 Alberto MontaÃ±ola Lacort
    Licensed under the GNU GPL. For full terms see the file COPYING.

    Id: $Id$

-->

<!ELEMENT sd7config (section)+>

<!ELEMENT section (option)*>
<!ATTLIST section
	name CDATA #REQUIRED>

<!ELEMENT option EMPTY>
<!ATTLIST option
	name CDATA #REQUIRED
	value CDATA #REQUIRED>
